{
  "$schema": "https://json-schema.org/draft/2020-12/schema",
  "$id": "https://cosmic-vikings/ar-agent/contracts/execution-summary.schema.json",
  "title": "ExecutionSummary",
  "description": "End-of-run summary returned in the envelope data field. Aggregates the run's totals, approvals, audit refs and checkpoint handle.",
  "x-contract-version": "1.0.0",
  "x-status": "draft",
  "x-since": "2026-07-06",
  "type": "object",
  "additionalProperties": false,
  "required": ["trace_id", "flow_id", "tenant", "intent", "status", "code", "totals", "started_at", "ended_at", "contract_version"],
  "properties": {
    "trace_id": {"type": "string", "minLength": 1},
    "flow_id": {"type": "string", "minLength": 1, "description": "Supervisor flow UUID (§12)."},
    "tenant": {"type": "string", "minLength": 1},
    "intent": {"type": "string", "minLength": 1},
    "status": {"type": "string", "enum": ["ok", "error", "pending_approval"], "description": "Mirrors the envelope status (§14)."},
    "code": {"type": "string", "pattern": "^AR_[A-Z_]+$", "description": "Stable AR_* code (§9)."},
    "totals": {
      "type": "object",
      "additionalProperties": false,
      "required": ["matched", "outstanding", "posted"],
      "properties": {
        "matched": {"type": "string", "pattern": "^\\d+\\.\\d{2}$", "description": "WorkflowState.matched_amount at completion (§8)."},
        "outstanding": {"type": "string", "pattern": "^\\d+\\.\\d{2}$", "description": "WorkflowState.outstanding_balance at completion."},
        "posted": {"type": "string", "pattern": "^\\d+\\.\\d{2}$", "description": "WorkflowState.posted_total at completion."}
      }
    },
    "started_at": {"type": "string", "pattern": "^\\d{4}-\\d{2}-\\d{2}T\\d{2}:\\d{2}:\\d{2}Z$"},
    "ended_at": {"type": "string", "pattern": "^\\d{4}-\\d{2}-\\d{2}T\\d{2}:\\d{2}:\\d{2}Z$"},
    "approvals": {
      "type": "array",
      "items": {"type": "string", "pattern": "^ar-approval-[0-9a-f]{8}-[0-9a-f]{4}-[0-9a-f]{4}-[0-9a-f]{4}-[0-9a-f]{12}$"},
      "description": "Approval refs touched by the run (§19)."
    },
    "audit_refs": {
      "type": "array",
      "items": {"type": "string", "minLength": 1},
      "description": "Audit record ids written (§13)."
    },
    "checkpoint_id": {"type": "string", "pattern": "^[0-9a-f]{8}-[0-9a-f]{4}-[0-9a-f]{4}-[0-9a-f]{4}-[0-9a-f]{12}$", "description": "Resume handle if the run paused (§11)."},
    "subflows_invoked": {
      "type": "array",
      "items": {"type": "string", "minLength": 1},
      "description": "ar_* subflow ids invoked, in order."
    },
    "error": {"$ref": "#/$defs/error", "description": "Present when status=error."},
    "contract_version": {"type": "string", "pattern": "^\\d+\\.\\d+\\.\\d+$"}
  },
  "$defs": {
    "error": {
      "type": "object",
      "additionalProperties": false,
      "required": ["code", "message"],
      "properties": {
        "code": {"type": "string", "pattern": "^AR_[A-Z_]+$"},
        "message": {"type": "string", "minLength": 1}
      },
      "description": "Mirrors the envelope error (§14); no raw exceptions (§9)."
    }
  }
}